<?xml version="1.0" encoding="UTF-8"?>
<!--
To change this license header, choose License Headers in Project Properties.
To change this template file, choose Tools | Templates
and open the template in the editor.
-->


<mail
    xmlns:xsi='http://www.w3.org/2001/XMLSchema-instance'
    xsi:noNamespaceSchemaLocation='esquema1.xsd'>
    <remitente>diego.casfre@educa.jcyl.es</remitente>
    <destinatario>david.apasir@educa.jcyl.es</destinatario>
    <destinatario>aroa.graoma@educa.jcyl.es</destinatario>
    <fecha>
        <dia>26</dia>
        <mes>01</mes>
        <anyo>2021</anyo>
    </fecha>
    <asunto>Prueba</asunto>
    <mensaje/>
    <ficherosAdjuntos>
        <nombreFichero>prueba.pdf</nombreFichero>
        <tipoMIME>application/pdf</tipoMIME>
    </ficherosAdjuntos>
    <ficherosAdjuntos>
        <nombreFichero>prueba.jpg</nombreFichero>
        <tipoMIME>image/jpeg</tipoMIME>
    </ficherosAdjuntos>
</mail>
